Link,Title,Text,Image,Date Publish
https://techxplore.com/news/2023-12-large-language-sarcasm.html,Can large language models detect sarcasm?,"This article has been reviewed according to Science X's editorial process and policies . Editors have highlighted the following attributes while ensuring the content's credibility:
Credit: Pixabay/CC0 Public Domain
Large language models (LLMs) are advanced deep learning algorithms that can analyze prompts in various human languages, subsequently generating realistic and exhaustive answers. This promising class of natural language processing (NLP) models has become increasingly popular after the release of Open AI's ChatGPT platform, which can rapidly answer a wide range of user queries and generate convincing written texts for different uses.
As these models become increasingly widespread, assessing their capabilities and limitations is of utmost importance. These evaluations can ultimately help to understand the situations in which LLMs are most or least useful, while also identifying ways in which they could be improved.
Juliann Zhou, a researcher at New York University, recently carried out a study aimed at assessing the performance of two LLMs trained to detect human sarcasm, which entails conveying ideas by ironically stating the exact opposite of what one is trying to say. Her findings, posted on the preprint server arXiv, helped her to delineate features and algorithmic components that could enhance the sarcasm detection capabilities of both AI agents and robots.
""In the field of sentimental analysis of Natural Language Processing, the ability to correctly identify sarcasm is necessary for understanding people's true opinions,"" Zhou wrote in her paper. ""Because the use of sarcasm is often context-based, previous research has used language representation models, such as Support Vector Machine (SVM) and Long Short-Term Memory (LSTM), to identify sarcasm with contextual-based information. Recent innovations in NLP have provided more possibilities for detecting sarcasm.""
Credit: Juliann Zhou.
Sentiment analysis is a field of research that entails analyzing texts typically posted on social medial platforms or other websites to gain insight on how people feel about a particular topic or product. Today, many companies are investing in this area, as it can help them to understand how they can improve their services and meet the needs of their customers.
There are now several NLP models that can process texts and predict their underlying emotional tone, or in other words if they are expressing positive, negative or neutral emotions. Many reviews and comments posted online, however, contain irony and sarcasm, which could trick models into classifying them as ""positive"" when they are in fact expressing a negative emotion, or vice versa.
Some computer scientists have thus been trying to develop models that can detect sarcasm in written texts. Two of the most promising among these models, called CASCADE and RCNN-RoBERTa, were presented in 2018 by distinct research groups.
""In BERT: Pre-training of deep bidirectional transformers for language understanding, Jacob Devlin et al (2018) introduced a new language representation model and demonstrated higher precision in interpreting contextualized language,"" Zhou wrote. ""As proposed by Hazarika et al (2018), CASCADE is a context-driven model that produces good results for detecting sarcasm. This study analyzes a Reddit corpus using these two state-of-the-art models and evaluates their performance against baseline models to find the ideal approach to sarcasm detection.""
Essentially, Zhou carried out a series of tests aimed at evaluating the ability of the CASCADE and RCNN-RoBERTa model to detect sarcasm in comments posted on Reddit, the renowned online platform typically used to rate content and discuss various topics. The ability of these two models to detect sarcasm in the sample texts was also compared to the average human performance on this same task (reported in a previous work) and to the performance of a few baseline models for analyzing texts.
""We found that contextual information, such as user personality embeddings, could significantly improve performance, as well as the incorporation of a transformer RoBERTa, compared with a more traditional CNN approach,"" Zhou concluded in her paper. ""Given the success of both contextual- and transformer-based approaches, as shown in our results, augmenting a transformer with additional contextual information features may be an avenue for future experiments.""
The results gathered as part of this recent study could soon guide further studies in this area, ultimately contributing to the development of LLMs that are better at detecting sarcasm and irony in human language. These models may eventually prove to be extremely valuable tools to quickly perform sentiment analyses of online reviews, posts, and other user-generated content.
More information: Juliann Zhou, An Evaluation of State-of-the-Art Large Language Models for Sarcasm Detection, arXiv (2023). DOI: 10.48550/arxiv.2312.03706 Journal information: arXiv
© 2023 Science X Network",https://scx2.b-cdn.net/gfx/news/hires/2023/sarcasm.jpg,2023-12-28 07:30:01
https://techxplore.com/news/2023-12-apple-smart-devices-smarter.html,Apple flash: Our smart devices will soon be smarter,"This article has been reviewed according to Science X's editorial process and policies . Editors have highlighted the following attributes while ensuring the content's credibility:
Credit: Pixabay/CC0 Public Domain
Our smart devices take voice commands from us, check our heartbeats, track our sleep, translate text, send us reminders, capture photos and movies, and let us talk to family and friends continents away.
Now imagine turbocharging those capabilities. Holding in-depth, natural language exchanges on academic or personal queries; running our vital signs through a global database to check on imminent health issues; packing massive databases to provide comprehensive real-time translation among two or more parties speaking different languages; and conversing with GPS software providing details on the best burgers, movies, hotels or people-watching spots trending along your route.
Tapping into the seductive power of large language models and natural language processing, we've witnessed tremendous progress in communications between us and technology that we increasingly rely on in our daily lives.
But there's been a stumbling block when it comes to AI and our portable devices. Researchers at Apple say they are ready to do something about it.
The issue is memory. Large language models need lots of it. With models demanding storage of potentially hundreds of billions of parameters, commonly used smartphones such as Apple's iPhone 15 with a scant 8GB of memory will fall far short of the task.
In a paper uploaded to the pre-print server arXiv on Dec. 12, Apple announced it had developed a method that utilizes transfers of data between flash memory and DRAM that will allow a smart device to run a powerful AI system.
The researchers say their process can run AI programs twice the size of a device's DRAM capacity and speed up CPU operations by up to 500%. GPU processes, they say, can be sped up to 25 times current approaches.
""Our method involves constructing an inference cost model that harmonizes with the flash memory behavior, guiding us to optimize in two critical areas: reducing the volume of data transferred from flash and reading data in larger, more contiguous chunks,"" the researchers said in their paper titled, ""LLM in a flash: Efficient Large Language Model Inference with Limited Memory.""
The two techniques they used were:
Windowing, which slashes the amount of data that needs to be exchanged between flash memory and RAM. This is accomplished by reusing results from recent calculations, minimizing IO requests and saving energy and time. Row column bundling, which achieves greater efficiency by digesting larger chunks of data at a time from flash memory.
The two processes, say the researchers, ""collectively contribute to a significant reduction in the data load and an increase in the efficiency of memory usage.""
They added, ""This breakthrough is particularly crucial for deploying advanced LLMs in resource-limited environments, thereby expanding their applicability and accessibility.""
In another recent breakthrough, Apple announced that it had designed a program called HUGS that can create animated avatars from just a few seconds worth of video captured from a single lens. Current avatar creation programs require multiple camera views. The report, ""HUGS: Human Gaussian Splats,"" was uploaded to arXiv Nov. 29.
Their program can create realistic dancing avatars in as little as 30 minutes, far shorter than the two days required for current popular approaches, according to Apple.
More information: Keivan Alizadeh et al, LLM in a flash: Efficient Large Language Model Inference with Limited Memory, arXiv (2023). DOI: 10.48550/arxiv.2312.11514 Journal information: arXiv
© 2023 Science X Network",https://scx2.b-cdn.net/gfx/news/hires/2021/apple-ios.jpg,2023-12-28 09:10:01
https://techxplore.com/news/2023-12-ai-chatbots-jailbreak.html,Researchers use AI chatbots against themselves to 'jailbreak' each other,"This article has been reviewed according to Science X's editorial process and policies . Editors have highlighted the following attributes while ensuring the content's credibility:
NTU Ph.D. student Mr. Liu Yi, who co-authored the paper, shows a database of successful jailbreaking prompts which managed to compromise AI chatbots, causing them to produce information that their developers deliberately restricted from revealing. Credit: Nanyang Technological University
Computer scientists from Nanyang Technological University, Singapore (NTU Singapore) have managed to compromise multiple artificial intelligence (AI) chatbots, including ChatGPT, Google Bard and Microsoft Bing Chat, to produce content that breaches their developers' guidelines—an outcome known as ""jailbreaking.""
""Jailbreaking"" is a term in computer security where computer hackers find and exploit flaws in a system's software to make it do something its developers deliberately restricted it from doing.
Furthermore, by training a large language model (LLM) on a database of prompts that had already been shown to hack these chatbots successfully, the researchers created an LLM chatbot capable of automatically generating further prompts to jailbreak other chatbots.
LLMs form the brains of AI chatbots, enabling them to process human inputs and generate text that is almost indistinguishable from that which a human can create. This includes completing tasks such as planning a trip itinerary, telling a bedtime story, and developing computer code.
The NTU researchers' work now adds ""jailbreaking"" to the list. Their findings may be critical in helping companies and businesses to be aware of the weaknesses and limitations of their LLM chatbots so that they can take steps to strengthen them against hackers.
After running a series of proof-of-concept tests on LLMs to prove that their technique indeed presents a clear and present threat to them, the researchers immediately reported the issues to the relevant service providers, upon initiating successful jailbreak attacks.
A jailbreak attack example. Credit: arXiv (2023). DOI: 10.48550/arxiv.2307.08715
Professor Liu Yang from NTU's School of Computer Science and Engineering, who led the study, said, ""Large Language Models (LLMs) have proliferated rapidly due to their exceptional ability to understand, generate, and complete human-like text, with LLM chatbots being highly popular applications for everyday use.""
""The developers of such AI services have guardrails in place to prevent AI from generating violent, unethical, or criminal content. But AI can be outwitted, and now we have used AI against its own kind to 'jailbreak' LLMs into producing such content.""
NTU Ph.D. student Mr. Liu Yi, who co-authored the paper, said, ""The paper presents a novel approach for automatically generating jailbreak prompts against fortified LLM chatbots. Training an LLM with jailbreak prompts makes it possible to automate the generation of these prompts, achieving a much higher success rate than existing methods. In effect, we are attacking chatbots by using them against themselves.""
The researchers' paper describes a two-fold method for ""jailbreaking"" LLMs, which they named ""Masterkey.""
First, they reverse-engineered how LLMs detect and defend themselves from malicious queries. With that information, they taught an LLM to automatically learn and produce prompts that bypass the defenses of other LLMs. This process can be automated, creating a jailbreaking LLM that can adapt to and create new jailbreak prompts even after developers patch their LLMs.
The researchers' paper, which appears on the pre-print server arXiv, has been accepted for presentation at the Network and Distributed System Security Symposium, a leading security forum, in San Diego, U.S., in February 2024.
Testing the limits of LLM ethics
AI chatbots receive prompts, or a series of instructions, from human users. All LLM developers set guidelines to prevent chatbots from generating unethical, questionable, or illegal content. For example, asking an AI chatbot how to create malicious software to hack into bank accounts often results in a flat refusal to answer on the grounds of criminal activity.
Professor Liu said, ""Despite their benefits, AI chatbots remain vulnerable to jailbreak attacks. They can be compromised by malicious actors who abuse vulnerabilities to force chatbots to generate outputs that violate established rules.""
The NTU researchers probed into ways of circumventing a chatbot by engineering prompts that slip under the radar of its ethical guidelines so that the chatbot is tricked into responding to them. For example, AI developers rely on keyword censors that pick up certain words that could flag potentially questionable activity and refuse to answer if such words are detected.
One strategy the researchers employed to get around keyword censors was to create a persona that provided prompts simply containing spaces after each character. This circumvents LLM censors, which might operate from a list of banned words.
The researchers also instructed the chatbot to reply in the guise of a persona ""unreserved and devoid of moral restraints,"" increasing the chances of producing unethical content.
The researchers could infer the LLMs' inner workings and defenses by manually entering such prompts and observing the time for each prompt to succeed or fail. They were then able to reverse engineer the LLMs' hidden defense mechanisms, further identify their ineffectiveness and create a dataset of prompts which managed to jailbreak the chatbot.
Escalating arms race between hackers and LLM developers
When vulnerabilities are found and revealed by hackers, AI chatbot developers respond by ""patching"" the issue, in an endlessly repeating cycle of cat-and-mouse between hacker and developer.
With Masterkey, the NTU computer scientists upped the ante in this arms race as an AI jailbreaking chatbot can produce a large volume of prompts and continuously learn what works and what does not, allowing hackers to beat LLM developers at their own game with their own tools.
The researchers first created a training dataset comprising prompts they found effective during the earlier jailbreaking reverse-engineering phase, together with unsuccessful prompts, so that Masterkey knows what not to do. The researchers fed this dataset into an LLM as a starting point and subsequently performed continuous pre-training and task tuning.
This exposes the model to a diverse array of information and sharpens the model's abilities by training it on tasks directly linked to jailbreaking. The result is an LLM that can better predict how to manipulate text for jailbreaking, leading to more effective and universal prompts.
The researchers found the prompts generated by Masterkey were three times more effective than prompts generated by LLMs in jailbreaking LLMs. Masterkey was also able to learn from past prompts that failed and can be automated to constantly produce new, more effective prompts.
The researchers say their LLM can be employed by developers themselves to strengthen their security.
NTU Ph.D. student Mr. Deng Gelei, who co-authored the paper, said, ""As LLMs continue to evolve and expand their capabilities, manual testing becomes both labor-intensive and potentially inadequate in covering all possible vulnerabilities. An automated approach to generating jailbreak prompts can ensure comprehensive coverage, evaluating a wide range of possible misuse scenarios.""
More information: Gelei Deng et al, MasterKey: Automated Jailbreak Across Multiple Large Language Model Chatbots, arXiv (2023). DOI: 10.48550/arxiv.2307.08715 Journal information: arXiv",https://scx2.b-cdn.net/gfx/news/hires/2023/researchers-use-ai-cha.jpg,2023-12-28 05:04:20
