Link,Title,Text,Image,Date Publish
https://techcrunch.com/2023/12/28/f5-collective-vc-firm-australia/,The Australian VC firm that sponsored California's diversity bill,"Access to venture funding for women is poor all over the world, but it’s particularly concerning in Australia, where less than 1% of all private-sector funding in the country went to solely women-founded and -led businesses in 2022. Down under, only 3% of venture capital funding went to all-women-founded teams, and 10% went to teams with at least one woman founder.
A downward trend is emerging. In 2021 and 2020, 21% and 25%, respectively, of VC funding in Australia went to startups with at least one woman founder.
For women of color, that number is even worse. A report commissioned by consulting firm the Creative Co-Operative found that in 2021, despite a record increase in VC funding in Australia — about $10 billion — just 0.03% went to Bla(c)k women and women of color founders. (In Australia, “Bla(c)k” represents Aboriginal and Torres Strait Islanders, African Australians, Pacific Islanders, etc.)
Tracey Warren (pictured above center), CEO of F5 Collective, an Australian VC firm and advocacy group that’s backed by a U.S. family fund, said she’s worried that women will see those statistics and wonder, “What’s the point? I can’t get funding anyway. I’m just gonna give up.”
That’s why Warren and the F5 Collective sponsored a California bill that mandates VCs to report the diversity of founders they’re backing, including race, disability status, gender and LGBTQ+ status. SB 54, which Gov. Gavin Newsom signed in October, goes into effect March 1, 2025.
“Anything that goes on in Silicon Valley has a ripple effect across the world,” Warren told TechCrunch+. “We needed a precedent, to set a framework to then take to the rest of the world.”
F5 has already invested in eight Asia-Pacific, woman-led startups (and is targeting 12) using its $5 million proof of concept fund, which came from the family office of Kelly Kimball, co-founder and executive chairman of Vitu and chairman of F5. The VC aims to raise another $100 million for its Fund 2 in the spring of 2024. That money will be used for follow-on funding for its current portfolio companies, and to help F5 reach its goal of investing in 1,000 female founders in APAC by 2030.
F5’s investment mandate is broad. The VC will invest in tech that shapes our future and social and environmental impact technology. The founding teams can be mixed, but a woman founder has to be in a position of actual leadership.
“None of that giving a woman 2% equity and shoving her into a founder title,” Warren said.
Beyond just giving women money, Warren and F5 want to create generational change for a billion women across India, Southeast Asia and Australia. The fund is just one piece of a five-pillar strategy that includes mentoring women to be angel investors, working with corporations to facilitate pilots and use cases for women-led startups, and advocating for policy changes.
That’s where California SB 54 came in. “What gets reported and measured gets changed,” Warren said. “If we don’t start reporting, we’ve got nothing to start with.”
Advocating for political change
Policy is F5’s second pillar. Enacting political change can be more difficult in Australia than it is in the U.S., in part because lobbying isn’t as robust down under, Warren said. She also said passing a bill like SB 54 in Australia would be difficult, to say the least, and take much longer than the three months it took to pass the bill in California.","https://techcrunch.com/wp-content/uploads/2023/12/F5-Collective_2-edit.jpg?resize=1200,675",2023-12-28 15:31:30
https://techcrunch.com/2023/12/28/australia-climate-tech-industry-booming/,"Australia's climate tech industry is booming, but it could bust without funds","Australia is a land of natural wonders, from the Great Barrier Reef and Daintree Rainforest to Kakadu National Park and the Blue Mountains. But because of the country’s naturally dry and biodiverse climate, it’s particularly vulnerable to extreme weather events that have been exacerbated by climate change. All of those wonders have been affected in recent years by bushfires, extreme heat waves, rising temperatures and floods.
Queensland is dealing with the worst flooding in history in the aftermath of Cyclone Ilsa. That’s on top of the aftermath of La Niña last year, which brought severe flooding and record-breaking rainfall to Eastern Australia. And before that, during the Black Summer of 2019 and 2020, the country lived through its most catastrophic bushfire that burned over 30,000 square kilometers of land and killed 3 billion animals. Add to this, around 90% of the Great Barrier Reef’s coral has been bleached white from rising sea temperatures.
Australia has experienced its fair share of a climate catastrophes, which has only fueled its climate tech startups into action.
The island continent is sparsely populated throughout most of its flat, dry, sunny center — referred to as the Red Centre — and has the perfect conditions to collect solar and wind energy. Large-scale solar and wind farms have spread across the country in recent years, causing renewable energy generation to increase from 16% in 2011 to 32% in 2022. Australia’s government has set a target of getting its grid to 82% renewable by 2030.
“Now there’s this perfect confluence of environmental issues, policy support and technological readiness that makes climate tech, particularly coming out of Australia, well positioned to really hit the next level of scale over the next five years,” said Jack Curtis, chief commercial officer at Neara.
But lack of capital needed to get startups to a scale-up phase could block access to Aussie innovation — an issue that is making itself known across the startup sector.
Neara works with utilities companies worldwide. It recently raised another USD$24 million to help its customers — like Southern California Edison — future-proof their infrastructure by creating 3D models to reflect and simulate how utility assets behave in the real-world environment in scenarios like drought or flooding.
The hype for climate tech in Australia is real, as long as it can be sustained. Local VCs are most excited about the sector this year, with climate and cleantech dominating in funding and deal count in Q3 2023. Startups in that sector raised $116 million in the third quarter, an increase from the $60 million invested in the segment in Q2 and $40 million in Q1, according to Cut Through Venture data. [Note: Numbers are in AUD unless otherwise stated.]
It’s been an upward trend for the past couple of years. In 2022, climate tech in Australia raised $553 million in capital, compared to $338 million in 2021, according to a report from Climate Salad, a community of Australian climate tech stakeholders. The goal was to raise another $1.5 billion this year, but the sector has fallen short due to delayed and unsuccessful capital raises, according to company co-founder Mick Liubinskas.
“We have a large number of companies that are looking at a Q1 2024 raise and more capital from international investors,” he said.
Startup founders say securing big checks is their biggest hurdle, but it’s the most important one to mount if they want to scale and survive.","https://techcrunch.com/wp-content/uploads/2023/12/australia-2023-climate.jpg?resize=1200,675",2023-12-28 15:30:46
https://techcrunch.com/2023/12/28/three-steps-to-take-your-company-out-of-the-one-product-mold/,Three steps to take your company out of the one-product mold,"All products have a life cycle, from development to introduction to growth and maturity. A fantastic product is not enough. To continue accelerating your company’s growth, you must go multi-product.
The transition to multi-product can be a significant revenue generator when done successfully. The proof can be seen with the best-in-class companies — from Apple to Adobe to ServiceNow — constantly adding multiple product offerings and expanding on their existing capabilities. Most of these companies make significant revenue on products that aren’t their inaugural ones and have managed to sustain a hyper-growth rate by having a multi-product offering.
We were a single-product company when I started working at monday.com in 2016. During my first few years, the company saw rapid growth as customers continued to use our software in new and inventive ways. It was amazing to witness, but it posed the question: How do we maintain this momentum? The challenge before us was as clear as the laws of nature state — the larger your customer group is, the harder it is to grow at the same rate. This is when we acted on our vision to conquer each core aspect of work with new, targeted products. In addition to adding new capabilities to our platform, we launched monday sales CRM and monday dev based on our customers’ needs. We’ve experienced growth from these new products that significantly surpasses those of our early monday days, with the annual recurring revenue for monday sales CRM and monday dev growing 22x and 4x faster, respectively.
With all that said, my most significant piece of advice is don’t be afraid to take risks.
While going multi-product can bring your business to the next level, leaders face several challenges when taking on this endeavor — from finding the right product-market fit and establishing a go-to-market strategy to timing and more. Drawing on my experience of graduating monday.com from the one-product mold, here are three steps to ensure your multi-product journey is successful.
If the (product-market) shoe fits
We all know that finding a product-market fit can be challenging, especially when you have limited resources and must move quickly to find and serve your target market. But there are a few signals that your initial offering has a wide product-market fit, and it would be easy for you to identify your second product:","https://techcrunch.com/wp-content/uploads/2019/01/GettyImages-958125096.jpg?resize=1200,800",2023-12-28 14:35:02
https://techcrunch.com/2023/12/28/cyber-criminals-2023/,Meet the cyber-criminals of 2023,"Once again we look back at the past year in cybercrime and those who we lost… to the law. This year was no different to last: we saw another round of high-profile busts, arrests, sanctions, and prison time for some of the most prolific cybercriminals in recent years.
This is our look back at who got nabbed or otherwise busted, featuring: why a Russian accused of ransomware burned his passport, which notorious malware gang reared its ugly head again, and why one country’s hackers targeted an unsuspecting phone maker.
For a time, Joseph James O’Connor was one of the internet’s most wanted hackers, not just by the feds investigating the breach, but for the curious public who watched his hack play out in real-time.
O’Connor was a member of the hacking group who broke into Twitter to abuse access to an internal admin tool that they used to hijack high-profile Twitter accounts, including Apple, Joe Biden, and Elon Musk (who went on to buy the site) to spread a crypto scam. Twitter took drastic measures to rid the hackers from its network by temporarily blocking all of the site’s 200-million-plus users from posting.
A New York judge sentenced the 24-year-old hacker to five years in prison, two of which O’Connor already served in pre-trial custody.
Federal prosecutors this year accused a former Amazon employee of hacking into a cryptocurrency exchange and stealing millions worth of customers’ crypto. The case appeared at first as an ethical hacker turning rogue by apparently offering to return the funds in return for a bug bounty. But ultimately Shakeeb Ahmed was caught out in part by Googling his own crimes that prosecutors say related to “his own criminal liability.”
In the end, Ahmed pleaded guilty earlier in December, according to the Justice Department, and faces up to five years in prison — and paying back $5 million to victims.
Why did a Russian man accused by U.S. prosecutors of ransomware attacks burn his passport? According to the accused hacker Mikhail Matveev, it’s because U.S. government charges would follow him anywhere he went and most countries would extradite him for the crimes he’s accused of — crimes he hasn’t denied, per se, but rather outwardly embraced. In an interview with TechCrunch, Matveev said the last time he traveled was to Thailand in 2014, but not since.
Federal prosecutors say Matveev is a “central figure” in developing and deploying the Hive, LockBit, and Babuk ransomware variants, which have resulted in millions of dollars worth of ransom payments. Matveev is believed to live in the Russian enclave of Kaliningrad where he remains tantalizingly close yet just out of reach of the authorities.
Hackers for the hermit kingdom were busier than ever this year, racking up hacks on popular crypto wallets and major crypto projects with the aim of making as much money for the regime from anywhere it can get it to fund its sanctioned nuclear weapons program.
Some of the cyberattacks linked to North Korea might not have made much sense on the face of it, but breaking into software companies gave the hackers access to the targets they were after. Enterprise phone provider 3CX said that North Korean hackers broke into its systems and planted malware in a tainted software update that rolled out to customers in a long-game effort to target 3CX’s crypto customers. Software company JumpCloud said it too was hacked by North Korean hackers likely in an effort to gather data on a handful of its crypto-related customers.
The FBI warned earlier this year that North Korean hackers were readying to cash out some of their recent crypto heists.
It took the feds about a decade but their persistence paid off when they finally identified the mastermind behind Try2Check, a credit card checking operation that allowed criminals who buy credit card numbers in bulk to identify which cards are still active. The scheme earned the Russian national, Denis Gennadievich Kulkov, more than $18 million in illicit proceeds — and a place on the U.S. Secret Service’s most wanted list with a $10 million bounty for information leading to Kulkov’s conviction. That might not be any time soon, given Kulkov remains in Russia and squarely out of the hands of U.S. prosecutors.
A prolific hacker and seller of stolen data, the administrator of the cybercrime forum BreachForuns known as Pompompurin, was busted on home turf by the FBI in a leafy town in upstate New York. BreachForums for a time was involved in the sale of millions of people’s data with more than 340,000 active members, to the point where the Justice Department saught to “disrupt” the site to knock it offline. The operation saw the arrest of Conor Brian Fitzpatrick, 20, following an extensive surveillance operation. In the end it wasn’t just charges of computer hacking and wire fraud that brought down the notorious hacking forum administrator, but also possession of child abuse imagery. Fitzpatrick subsequently pleaded guilty and will be sentenced at a later date.
Qakbot was one of the longest running and high-profile hacking groups of the past decade, and once the malware-of-choice for delivering ransomware to companies, organizations and governments around the world, generating tens of millions of dollars in ransom payments. At its peak, the FBI said Qakbot had compromised more than 700,000 devices as of June 2023, with at least 200,000 hacked devices located in the United States. In a daring effort to knock the malware offline for good, the FBI launched Operation Duck Hunt (don’t say that too quickly), which tricked Qakbot-infected computers into downloading an FBI-made uninstaller, ridding the malware from the infected device. The operation was hailed as a success. But recent Qakbot infections suggests that the takedown was little more than a short setback.
In what is likely the last cyber-related conviction of the year: a hacker accused of involvement with the prolific Lapsus$ hacking group will be detained until doctors determine he no longer poses a threat to the public. Arion Kurtaj, a teenager from Oxford, was sentenced to an indefinite hospital order in December, reports the BBC. Kurtaj is one of several hackers who raided Rockstar Games, Uber, Nvidia and telecom giant EE who used social engineering and threats to score access to corporate networks. The judge said the teenager’s skills and desire to continue committing cybercrime meant he remains a high risk to the public.
Arion Kurtaj has been given an indefinite hospital order. Judge rules that he remains a high risk to the public through his skills and motivation. He will remain at a secure hospital for life unless doctors deem him no longer a danger. — Joe Tidy (@joetidy) December 21, 2023
Read more on TechCrunch:","https://techcrunch.com/wp-content/uploads/2023/12/cyber-criminals-indicted.jpg?resize=1200,800",2023-12-28 13:05:37
