Link,Title,Text,Image,Date Publish
https://www.forbes.com/sites/paultassi/2023/12/28/rebel-moons-viewership-compares-poorly-to-other-2023-netflix-movies/,Rebel Moon’s Viewership Compares Poorly To Other 2023 Netflix Movies,"Rebel Moon Netflix
While The Hollywood Reporter is declaring that Zack Snyder’s Rebel Moon had a “solid” debut after its opening weekend this holiday, I’m not so sure.
Rebel Moon attracted 23.9 million views in its three day launch, which began December 21. A “solid kickoff” for a movie that doesn’t have huge stars and is an original IP, says THR. But you still have to view those numbers in context, and that’s when things don’t start to look so good, especially for a high profile action blockbuster that Netflix spent a ton of capital marketing, including a full homepage takeover of the entire service on login, something I’ve never seen before.
Of Netflix’s original movies of 2023, Rebel Moon is actually in ninth place, behind many lower profile offerings. And it’s done close to half of what the top four did after three days.
Murder Mystery 2 – 42.9 million The Mother – 42.9 million Extraction 2 – 42.8 million Leave the World Behind – 41.7 million Heart of Stone – 33.1 million You People – 28.3 million The Killer – 27.9 million Your Place or Mine – 27.7 million Rebel Moon – 23.9 million The Pale Blue Eye – 19.8 million The Out-Laws – 19.6 million We Have a Ghost – 19.1 million Reptile – 17.7 million Chupa – 15.5 million Love at First Sight – 14.1 million
I genuinely had to look a few of these up to remember what they even were. The Mother was Jennifer Lopez as an assassin getting back in the field. Heart of Stone was a Gal Gadot spy movie. You People was a comedy led by Jonah Hill and Eddie Murphy. Your Place or Mine was an Ashton Kutcher Reese Witherspoon romcom. The Pale Blue Eye was a mystery thriller where Edgar Allen Poe solves crimes.
You People Netflix
So no, it does not seem amazing that a Jonah Hill comedy got 5 million more views its opening weekend than Rebel Moon. It is true that Rebel Moon lacks the star power of most films here, as those at least have one star you’ve probably heard of, while it’s led by Sofia Boutella, Charlie Hunnam, Ed Skrein and Michael Huisman, names you probably only know if you’re really, really into movies and TV. It is true that Snyder himself is the draw, or if you just…thought the trailer and promos looked cool.
But after its debut, it’s become his lowest critically reviewed film ever, and also, over time, attracted one of his lowest audience scores as well. While many may not like the film at baseline, two huge specific points constantly brought up were the decision to split the movie in half, where the other part debuts in April, and to released a rather mangled PG-13 cut, eliminating sex and violence in a version that Snyder himself has indicated is very much inferior. Another issue is that after these initial views, Rebel Moon seems unlikely to garner the type of positive word of mouth to make it a longer term hit.
So no, I don’t think that for a movie with this high a budget and this much promotion you can spin that this is a “solid” debut. That said, Netflix is already locked into both the second part and that promised R-rated director’s cut. But this becoming a Star Wars-like original IP for them seems extremely unlikely past that.
Follow me on Twitter, Threads, YouTube, and Instagram. Subscribe to my free weekly content round-up newsletter, God Rolls.
Pick up my sci-fi novels the Herokiller series and The Earthborn Trilogy.",https://imageio.forbes.com/specials-images/imageserve/6582ec437b44a9e768931c25/0x0.jpg?format=jpg&height=900&width=1600&fit=bounds,2023-12-28 10:21:57
https://www.forbes.com/sites/williamhaseltine/2023/12/28/beyond-traditional-treatments-laser-therapies-for-diabetic-macular-edema/,Beyond Traditional Treatments: Laser Therapies For Diabetic Macular Edema,"Futuristic Eye Image By WangXiNa
This story is part of a series on the current progression in Regenerative Medicine. This piece is part of a series dedicated to the eye and improvements in restoring vision.
In 1999, I defined regenerative medicine as the collection of interventions that restore tissues and organs damaged by disease, injured by trauma, or worn by time to normal function. I include a full spectrum of chemical, gene, and protein-based medicines, cell-based therapies, and biomechanical interventions that achieve that goal.
Diabetic macular edema is a severe complication of diabetes that affects a person's vision and can lead to blindness if left untreated. Diabetic macular edema (DME) is a leading cause of vision loss among people with diabetes, and its prevalence is increasing. More specifically, the University of Toronto found that the pooled prevalence of DME was approximately 5.5% among people with diabetes. However, the good news is that effective treatments are available, including laser photocoagulation therapy.
Laser therapy, specifically subthreshold and multimodal imaging-guided laser therapy techniques, has emerged as an essential treatment option for DME. These cutting-edge therapies are more precise, less invasive, and offer significant advantages over traditional laser therapy. They can reduce the need for frequent follow-up appointments, improve treatment outcomes, and significantly reduce patient treatment burden.
More on Diabetic Macular Edema
Diabetic macular edema (DME) is a severe complication of diabetes that can lead to vision loss and blindness if left untreated. It is a type of macular edema that occurs when fluid accumulates in the macula, which is the central part of the retina responsible for sharp, detailed vision.
DME is caused by damage to the retina's blood vessels due to high blood sugar levels over time. This damage causes the blood vessels to leak fluid into the macula, leading to swelling and distortion of the central vision. Symptoms include blurred or distorted vision, difficulty reading or recognizing faces, and dark or empty spots in the central vision. If left untreated, it can cause permanent damage to the retina and lead to severe vision loss or blindness.
The condition is chronic and progressive, so early detection and prompt treatment are essential to prevent severe vision loss. Fortunately, effective treatments are available, including medications that can be injected into the eye to reduce swelling and improve vision.
The first-line treatment is anti-vascular endothelial growth factor (VEGF) therapy, which involves injections into the eye to prevent the growth of abnormal blood vessels that can contribute to edema. However, laser photocoagulation therapy can also be used as an alternative or in conjunction with anti-VEGF therapy.
What is Laser Photocoagulation?
Laser photocoagulation therapy involves using a laser to create thermal burns on the retina, which seal leaking blood vessels and reduce edema. The treatment has been used for DME for over 30 years and effectively reduces vision loss. Focal laser photocoagulation is the most commonly used technique, which targets microaneurysms or tiny fluid-filled sacs on the retina. The treatment is usually performed in an outpatient setting and can be completed in a single session.
Despite the effectiveness of laser photocoagulation therapy, its use has declined with the advent of anti-VEGF therapy. However, recent research by Nagoya City University has shown that laser therapy remains a practical therapeutic approach to chronic refractory edema. The key to successful laser therapy is identifying microaneurysms using multimodal, highly accurate, and minimally invasive coagulation techniques.
The image that is displayed below provides a comprehensive summary of the different types and settings of laser therapies that are currently available. In particular, the figure highlights two different types of laser therapy: focal and subthreshold.
A concise overview of current laser therapies. Focal laser targeting microaneurysms recommends short ... [+] duration of application with the assistance of fluorescein angiography, indocyanine green angiography, optical coherence tomography B-scan, or OCT angiography. Alternatively, subthreshold laser targets the retinal pigment epithelium with the help of FA or OCT thickness map. © 2023 by Nozaki, M., Ando, R., Kimura, T., Kato, F., & Yasukawa, T.
Focal laser therapy is used to target microaneurysms in the eye, and it is recommended that the duration of laser application should be kept short. The planning aspect of this therapy will involve the use of several imaging techniques such as fluorescein angiography (FA), indocyanine green angiography (ICGA), optical coherence tomography (OCT) B-scan, or OCT angiography (OCTA) to ensure accuracy.
Subthreshold laser therapy targets the retinal pigment epithelium (RPE). During the planning stage of this therapy, the image of the FA or OCT thickness map would be used to ensure the correct positioning of the laser.
Cutting-edge Laser Therapy Options
Furthermore, subthreshold laser therapy is a relatively new technique that uses lower energy levels than conventional laser therapy. This technique treats various retinal diseases, including diabetic macular edema and retinal vein occlusion. Subthreshold laser therapy has several advantages over traditional laser therapy.
Firstly, it reduces the frequency of anti-VEGF injections, often required in conjunction with laser therapy. This reduces the treatment burden on patients and improves their quality of life. Secondly, subthreshold laser therapy has the potential to provide longer-lasting treatment, which reduces the need for frequent follow-up appointments.
Multimodal imaging-guided laser therapy is another promising technique that combines various imaging modalities, such as optical coherence tomography (OCT), fundus photography, and fluorescein angiography. This technique allows for better visualization of microaneurysms, small bulges in the retina's blood vessels that can cause vision loss.
Visualizing these microaneurysms makes it easier to target them with laser therapy. This technique can optimize anti-VEGF therapy and reduce treatment burden. Additionally, multimodal imaging-guided laser therapy can treat other retinal diseases, such as age-related macular degeneration and retinal vein occlusion.
Looking Forward
While anti-VEGF therapy remains the first-line treatment, laser therapy can be used as an alternative or in combination with anti-VEGF therapy. Using precise, minimally invasive coagulation techniques, such as multimodal imaging-guided and subthreshold laser therapy, can improve treatment outcomes and reduce treatment burden.
Further studies are needed to determine the optimal timing and settings for laser photocoagulation therapy and the potential of new laser technologies in managing DME. Nevertheless, laser photocoagulation therapy remains a valuable treatment option for DME, and its use should be considered in the management of this chronic and progressive condition.
To learn more about the eye, read more stories at www.williamhaseltine.com",https://imageio.forbes.com/specials-images/imageserve/658d8f9ee5e9abfd5dd4c353/0x0.jpg?format=jpg&height=900&width=1600&fit=bounds,2023-12-28 10:17:31
https://www.forbes.com/sites/paultassi/2023/12/28/three-theories-for-starfields-sudden-surge-of-negative-reviews/,Three Theories For Starfield’s Sudden Surge Of Negative Reviews,"Starfield Bethesda
Starfield was the most Googled game of 2023, and I understand why. I have not seen any game spark more conversation on this website than Starfield, including even other controversial titles like Hogwarts Legacy or hugely praised offerings like Baldur’s Gate 3. It seems we will never be free of it, and now people are talking about a new development.
Starfield now has “Mostly Negative” reviews on Steam for the last 30 days, a drop from the (also not ideal) “Mixed” reviews previously. It has 87,519 all-time reviews right now, making that Mixed status. But the 7,594 recent reviews are Mostly Negative.
Why? Why the sudden drop in review scores from players two months after launch? I think there are three main reasons here, and none of them are “haters are review bombing!!!” I think there are legitimate things to examine here, as I didn’t understand this development at first myself either.
Starfield Steam
1. The Game Is Long, And People Are Just Now Finishing
While two months seems like a long time, it is actually not that long in Starfield’s timeline. This is a game you can easily put 60, 100, 150 hours into, given its sprawling size. And for people who’s do not play video games for a living like me, you can understand how that might easily take two months to get that far in the game.
I can buy the idea that you can play the game for that long and end up with an overall negative view if you believe that ultimately, it becomes too shallow, or discover its promised New Game Plus loops are not that interesting (this was my biggest problem with the game, even liking most other things). I think there’s a chunk of time between 15-40 hours where you really get into the flow of the game, but longer tail? You may run out of stuff to do and it’s a lot of shooting through clone stamped bases on largely empty planets. So if you end your time petering off and doing that, or starting over in a not-satisfying Starborn loop, I can see why negative reviews would start now.
Starfield Bethesda
2. Non-Game Pass Players Are Finally Picking It Up
Another theory that makes sense and can add to the above is that we have gotten past the initial surge of those who were A) super interested in the game from the start and B) jumping into it on the Xbox Game Pass ecosystem. You have to buy the game on Steam, and after holiday sales where it was (and is) cheaper on the platform, that may change things.
If you pick Starfield up for “free” on Game Pass, that’s a different context than someone being on the fence, picking it up, and deciding pretty quickly, “yeah I don’t like this.” Different crowd, different kind of dollar investment, and again, I can see more negative reviews being added that way.
3. Content Creator Videos
This may sound like an insult to the masses, but I sort of understand it. There have been a number of high profile videos released as retrospectives about Starfield, including an eight hour(!) examination by Patrician TV and a widely-shared video by NakeyJakey that has amassed 4.2 million views in two weeks, both hugely critical of Starfield and its “dated” Bethesda game design.
I didn’t quite get this, as what, do people see these videos, hear it’s bad, then go buy the game and review it poorly? But I do think watching these well-made critical videos can cause reflection in those that have already purchased it. Even as someone who liked the game, I found myself watching NakeyJakey’s video and agreeing with much of what he said. No, not enough to go and retroactively change my review score or post a bad Steam review, but I do sort of get why a critic pointing out flaws in an intelligent way could spark some action like that. I don’t think it’s necessarily a “sheep following the big name youtuber” situation, I do believe there’s legitimacy to reflecting on a game and perhaps liking it less over time.
So yeah, that’s what I think is going on here, and why it all adds up to a flurry of recent, negative reviews. I’m sure Bethesda hates to see this, and I really do wonder what they might be planning to try to turn the narrative around.
Follow me on Twitter, Threads, YouTube, and Instagram. Subscribe to my free weekly content round-up newsletter, God Rolls.
Pick up my sci-fi novels the Herokiller series and The Earthborn Trilogy.",https://imageio.forbes.com/specials-images/imageserve/645b96911a926b82bfb32fd4/0x0.jpg?format=jpg&height=900&width=1600&fit=bounds,2023-12-28 10:03:08
